{
  "$schema": "http://json-schema.org/draft-07/schema#",
  "$id": "https://agentplane.org/schemas/knowledge-ref.schema.json",
  "title": "KnowledgeRef (v1)",
  "description": "Digest-addressed reference into AgentPlane's existing context knowledge plane. The contract references knowledge; it does not copy or persist a second knowledge store.",
  "type": "object",
  "properties": {
    "schema_version": {
      "type": "number",
      "const": 1
    },
    "ref": {
      "type": "string",
      "minLength": 1,
      "maxLength": 2048,
      "pattern": "^(?:context\\/wiki\\/(?!\\.{1,2}(?:\\/|#|$))(?![^#]*\\/\\.{1,2}(?:\\/|#|$))(?![^#]*\\/\\/)(?![^#]*[?\\\\\\u0000-\\u001F\\u007F])(?=[^#]*[^\\s#](?:#|$))[^#]+(?:#(?:line=[1-9]\\d{0,8}|lines=[1-9]\\d{0,8}-[1-9]\\d{0,8}|section=[a-z0-9]+(?:-[a-z0-9]+)*))?|context\\/raw\\/(?!\\.{1,2}(?:\\/|#|$))(?![^#]*\\/\\.{1,2}(?:\\/|#|$))(?![^#]*\\/\\/)(?![^#]*[?\\\\\\u0000-\\u001F\\u007F])(?=[^#]*[^\\s#](?:#|$))[^#]+(?:#(?:line=[1-9]\\d{0,8}|lines=[1-9]\\d{0,8}-[1-9]\\d{0,8}|section=[a-z0-9]+(?:-[a-z0-9]+)*))?|\\.agentplane\\/context\\/derived\\/facts\\/facts\\.jsonl#fact=(?:[A-Za-z0-9_.!~*'():-]|(?:%22|%23|%24|%25|%26|%2B|%2C|%2F|%3B|%3C|%3D|%3E|%3F|%40|%5B|%5C|%5D|%5E|%60|%7B|%7C|%7D)|(?!(?:%C2%A0|%E1%9A%80|%E2%80%80|%E2%80%81|%E2%80%82|%E2%80%83|%E2%80%84|%E2%80%85|%E2%80%86|%E2%80%87|%E2%80%88|%E2%80%89|%E2%80%8A|%E2%80%A8|%E2%80%A9|%E2%80%AF|%E2%81%9F|%E3%80%80|%EF%BB%BF))(?:%(?:C[2-9A-F]|D[0-9A-F])%[89AB][0-9A-F]|%E0%[AB][0-9A-F]%[89AB][0-9A-F]|%E[1-9ABC]%[89AB][0-9A-F]%[89AB][0-9A-F]|%ED%[89][0-9A-F]%[89AB][0-9A-F]|%E[EF]%[89AB][0-9A-F]%[89AB][0-9A-F]|%F0%(?:9[0-9A-F]|[AB][0-9A-F])%[89AB][0-9A-F]%[89AB][0-9A-F]|%F[1-3]%[89AB][0-9A-F]%[89AB][0-9A-F]%[89AB][0-9A-F]|%F4%8[0-9A-F]%[89AB][0-9A-F]%[89AB][0-9A-F]))(?:(?:[A-Za-z0-9_.!~*'():-]|(?:%20|%22|%23|%24|%25|%26|%2B|%2C|%2F|%3B|%3C|%3D|%3E|%3F|%40|%5B|%5C|%5D|%5E|%60|%7B|%7C|%7D)|(?:%(?:C[2-9A-F]|D[0-9A-F])%[89AB][0-9A-F]|%E0%[AB][0-9A-F]%[89AB][0-9A-F]|%E[1-9ABC]%[89AB][0-9A-F]%[89AB][0-9A-F]|%ED%[89][0-9A-F]%[89AB][0-9A-F]|%E[EF]%[89AB][0-9A-F]%[89AB][0-9A-F]|%F0%(?:9[0-9A-F]|[AB][0-9A-F])%[89AB][0-9A-F]%[89AB][0-9A-F]|%F[1-3]%[89AB][0-9A-F]%[89AB][0-9A-F]%[89AB][0-9A-F]|%F4%8[0-9A-F]%[89AB][0-9A-F]%[89AB][0-9A-F]))*(?:[A-Za-z0-9_.!~*'():-]|(?:%22|%23|%24|%25|%26|%2B|%2C|%2F|%3B|%3C|%3D|%3E|%3F|%40|%5B|%5C|%5D|%5E|%60|%7B|%7C|%7D)|(?!(?:%C2%A0|%E1%9A%80|%E2%80%80|%E2%80%81|%E2%80%82|%E2%80%83|%E2%80%84|%E2%80%85|%E2%80%86|%E2%80%87|%E2%80%88|%E2%80%89|%E2%80%8A|%E2%80%A8|%E2%80%A9|%E2%80%AF|%E2%81%9F|%E3%80%80|%EF%BB%BF))(?:%(?:C[2-9A-F]|D[0-9A-F])%[89AB][0-9A-F]|%E0%[AB][0-9A-F]%[89AB][0-9A-F]|%E[1-9ABC]%[89AB][0-9A-F]%[89AB][0-9A-F]|%ED%[89][0-9A-F]%[89AB][0-9A-F]|%E[EF]%[89AB][0-9A-F]%[89AB][0-9A-F]|%F0%(?:9[0-9A-F]|[AB][0-9A-F])%[89AB][0-9A-F]%[89AB][0-9A-F]|%F[1-3]%[89AB][0-9A-F]%[89AB][0-9A-F]%[89AB][0-9A-F]|%F4%8[0-9A-F]%[89AB][0-9A-F]%[89AB][0-9A-F])))?|\\.agentplane\\/context\\/derived\\/graph\\/entities\\.jsonl#entity=(?:[A-Za-z0-9_.!~*'():-]|(?:%22|%23|%24|%25|%26|%2B|%2C|%2F|%3B|%3C|%3D|%3E|%3F|%40|%5B|%5C|%5D|%5E|%60|%7B|%7C|%7D)|(?!(?:%C2%A0|%E1%9A%80|%E2%80%80|%E2%80%81|%E2%80%82|%E2%80%83|%E2%80%84|%E2%80%85|%E2%80%86|%E2%80%87|%E2%80%88|%E2%80%89|%E2%80%8A|%E2%80%A8|%E2%80%A9|%E2%80%AF|%E2%81%9F|%E3%80%80|%EF%BB%BF))(?:%(?:C[2-9A-F]|D[0-9A-F])%[89AB][0-9A-F]|%E0%[AB][0-9A-F]%[89AB][0-9A-F]|%E[1-9ABC]%[89AB][0-9A-F]%[89AB][0-9A-F]|%ED%[89][0-9A-F]%[89AB][0-9A-F]|%E[EF]%[89AB][0-9A-F]%[89AB][0-9A-F]|%F0%(?:9[0-9A-F]|[AB][0-9A-F])%[89AB][0-9A-F]%[89AB][0-9A-F]|%F[1-3]%[89AB][0-9A-F]%[89AB][0-9A-F]%[89AB][0-9A-F]|%F4%8[0-9A-F]%[89AB][0-9A-F]%[89AB][0-9A-F]))(?:(?:[A-Za-z0-9_.!~*'():-]|(?:%20|%22|%23|%24|%25|%26|%2B|%2C|%2F|%3B|%3C|%3D|%3E|%3F|%40|%5B|%5C|%5D|%5E|%60|%7B|%7C|%7D)|(?:%(?:C[2-9A-F]|D[0-9A-F])%[89AB][0-9A-F]|%E0%[AB][0-9A-F]%[89AB][0-9A-F]|%E[1-9ABC]%[89AB][0-9A-F]%[89AB][0-9A-F]|%ED%[89][0-9A-F]%[89AB][0-9A-F]|%E[EF]%[89AB][0-9A-F]%[89AB][0-9A-F]|%F0%(?:9[0-9A-F]|[AB][0-9A-F])%[89AB][0-9A-F]%[89AB][0-9A-F]|%F[1-3]%[89AB][0-9A-F]%[89AB][0-9A-F]%[89AB][0-9A-F]|%F4%8[0-9A-F]%[89AB][0-9A-F]%[89AB][0-9A-F]))*(?:[A-Za-z0-9_.!~*'():-]|(?:%22|%23|%24|%25|%26|%2B|%2C|%2F|%3B|%3C|%3D|%3E|%3F|%40|%5B|%5C|%5D|%5E|%60|%7B|%7C|%7D)|(?!(?:%C2%A0|%E1%9A%80|%E2%80%80|%E2%80%81|%E2%80%82|%E2%80%83|%E2%80%84|%E2%80%85|%E2%80%86|%E2%80%87|%E2%80%88|%E2%80%89|%E2%80%8A|%E2%80%A8|%E2%80%A9|%E2%80%AF|%E2%81%9F|%E3%80%80|%EF%BB%BF))(?:%(?:C[2-9A-F]|D[0-9A-F])%[89AB][0-9A-F]|%E0%[AB][0-9A-F]%[89AB][0-9A-F]|%E[1-9ABC]%[89AB][0-9A-F]%[89AB][0-9A-F]|%ED%[89][0-9A-F]%[89AB][0-9A-F]|%E[EF]%[89AB][0-9A-F]%[89AB][0-9A-F]|%F0%(?:9[0-9A-F]|[AB][0-9A-F])%[89AB][0-9A-F]%[89AB][0-9A-F]|%F[1-3]%[89AB][0-9A-F]%[89AB][0-9A-F]%[89AB][0-9A-F]|%F4%8[0-9A-F]%[89AB][0-9A-F]%[89AB][0-9A-F])))?|\\.agentplane\\/context\\/derived\\/graph\\/(?:edges|provenance_edges)\\.jsonl#edge=(?:[A-Za-z0-9_.!~*'():-]|(?:%22|%23|%24|%25|%26|%2B|%2C|%2F|%3B|%3C|%3D|%3E|%3F|%40|%5B|%5C|%5D|%5E|%60|%7B|%7C|%7D)|(?!(?:%C2%A0|%E1%9A%80|%E2%80%80|%E2%80%81|%E2%80%82|%E2%80%83|%E2%80%84|%E2%80%85|%E2%80%86|%E2%80%87|%E2%80%88|%E2%80%89|%E2%80%8A|%E2%80%A8|%E2%80%A9|%E2%80%AF|%E2%81%9F|%E3%80%80|%EF%BB%BF))(?:%(?:C[2-9A-F]|D[0-9A-F])%[89AB][0-9A-F]|%E0%[AB][0-9A-F]%[89AB][0-9A-F]|%E[1-9ABC]%[89AB][0-9A-F]%[89AB][0-9A-F]|%ED%[89][0-9A-F]%[89AB][0-9A-F]|%E[EF]%[89AB][0-9A-F]%[89AB][0-9A-F]|%F0%(?:9[0-9A-F]|[AB][0-9A-F])%[89AB][0-9A-F]%[89AB][0-9A-F]|%F[1-3]%[89AB][0-9A-F]%[89AB][0-9A-F]%[89AB][0-9A-F]|%F4%8[0-9A-F]%[89AB][0-9A-F]%[89AB][0-9A-F]))(?:(?:[A-Za-z0-9_.!~*'():-]|(?:%20|%22|%23|%24|%25|%26|%2B|%2C|%2F|%3B|%3C|%3D|%3E|%3F|%40|%5B|%5C|%5D|%5E|%60|%7B|%7C|%7D)|(?:%(?:C[2-9A-F]|D[0-9A-F])%[89AB][0-9A-F]|%E0%[AB][0-9A-F]%[89AB][0-9A-F]|%E[1-9ABC]%[89AB][0-9A-F]%[89AB][0-9A-F]|%ED%[89][0-9A-F]%[89AB][0-9A-F]|%E[EF]%[89AB][0-9A-F]%[89AB][0-9A-F]|%F0%(?:9[0-9A-F]|[AB][0-9A-F])%[89AB][0-9A-F]%[89AB][0-9A-F]|%F[1-3]%[89AB][0-9A-F]%[89AB][0-9A-F]%[89AB][0-9A-F]|%F4%8[0-9A-F]%[89AB][0-9A-F]%[89AB][0-9A-F]))*(?:[A-Za-z0-9_.!~*'():-]|(?:%22|%23|%24|%25|%26|%2B|%2C|%2F|%3B|%3C|%3D|%3E|%3F|%40|%5B|%5C|%5D|%5E|%60|%7B|%7C|%7D)|(?!(?:%C2%A0|%E1%9A%80|%E2%80%80|%E2%80%81|%E2%80%82|%E2%80%83|%E2%80%84|%E2%80%85|%E2%80%86|%E2%80%87|%E2%80%88|%E2%80%89|%E2%80%8A|%E2%80%A8|%E2%80%A9|%E2%80%AF|%E2%81%9F|%E3%80%80|%EF%BB%BF))(?:%(?:C[2-9A-F]|D[0-9A-F])%[89AB][0-9A-F]|%E0%[AB][0-9A-F]%[89AB][0-9A-F]|%E[1-9ABC]%[89AB][0-9A-F]%[89AB][0-9A-F]|%ED%[89][0-9A-F]%[89AB][0-9A-F]|%E[EF]%[89AB][0-9A-F]%[89AB][0-9A-F]|%F0%(?:9[0-9A-F]|[AB][0-9A-F])%[89AB][0-9A-F]%[89AB][0-9A-F]|%F[1-3]%[89AB][0-9A-F]%[89AB][0-9A-F]%[89AB][0-9A-F]|%F4%8[0-9A-F]%[89AB][0-9A-F]%[89AB][0-9A-F])))?)$"
    },
    "digest": {
      "type": "string",
      "pattern": "^sha256:[0-9a-f]{64}$"
    },
    "kind": {
      "type": "string",
      "enum": ["wiki", "fact", "entity", "edge", "source"]
    },
    "reason": {
      "type": "string",
      "minLength": 1,
      "maxLength": 4096,
      "pattern": "^\\S(?:[\\s\\S]*\\S)?$"
    },
    "retrieval": {
      "type": "string",
      "enum": ["exact", "fts", "alias", "graph", "semantic_rerank"]
    },
    "required": {
      "type": "boolean"
    },
    "score": {
      "type": "number",
      "minimum": 0,
      "maximum": 1
    }
  },
  "required": ["schema_version", "ref", "digest", "kind", "reason", "retrieval", "required"],
  "additionalProperties": false,
  "allOf": [
    {
      "oneOf": [
        {
          "properties": {
            "kind": {
              "const": "wiki"
            },
            "ref": {
              "type": "string",
              "pattern": "^context/wiki/[^#]+(?:#(?:line|lines|section)=[^#]+)?$"
            }
          },
          "required": ["kind", "ref"]
        },
        {
          "properties": {
            "kind": {
              "const": "source"
            },
            "ref": {
              "type": "string",
              "pattern": "^context/raw/[^#]+(?:#(?:line|lines|section)=[^#]+)?$"
            }
          },
          "required": ["kind", "ref"]
        },
        {
          "properties": {
            "kind": {
              "const": "fact"
            },
            "ref": {
              "type": "string",
              "pattern": "^\\.agentplane/context/derived/facts/facts\\.jsonl#fact=[^#]+$"
            }
          },
          "required": ["kind", "ref"]
        },
        {
          "properties": {
            "kind": {
              "const": "entity"
            },
            "ref": {
              "type": "string",
              "pattern": "^\\.agentplane/context/derived/graph/entities\\.jsonl#entity=[^#]+$"
            }
          },
          "required": ["kind", "ref"]
        },
        {
          "properties": {
            "kind": {
              "const": "edge"
            },
            "ref": {
              "type": "string",
              "pattern": "^\\.agentplane/context/derived/graph/(?:edges|provenance_edges)\\.jsonl#edge=[^#]+$"
            }
          },
          "required": ["kind", "ref"]
        }
      ]
    },
    {
      "anyOf": [
        {
          "properties": {
            "ref": {
              "type": "string",
              "pattern": "^(?!.*#lines=)"
            }
          },
          "required": ["ref"]
        },
        {
          "properties": {
            "ref": {
              "type": "string",
              "pattern": "^(?:context/wiki/|context/raw/)[^#]+#lines=(?:[1-9]\\d{0}-[1-9]\\d{1,8}|[1-9]\\d{1}-[1-9]\\d{2,8}|[1-9]\\d{2}-[1-9]\\d{3,8}|[1-9]\\d{3}-[1-9]\\d{4,8}|[1-9]\\d{4}-[1-9]\\d{5,8}|[1-9]\\d{5}-[1-9]\\d{6,8}|[1-9]\\d{6}-[1-9]\\d{7,8}|[1-9]\\d{7}-[1-9]\\d{8,8}|([1-9]\\d{0})-\\1|(?:1\\d{0}-[2-9]\\d{0}|2\\d{0}-[3-9]\\d{0}|3\\d{0}-[4-9]\\d{0}|4\\d{0}-[5-9]\\d{0}|5\\d{0}-[6-9]\\d{0}|6\\d{0}-[7-9]\\d{0}|7\\d{0}-[8-9]\\d{0}|8\\d{0}-[9-9]\\d{0})|([1-9]\\d{1})-\\2|(?:1\\d{1}-[2-9]\\d{1}|2\\d{1}-[3-9]\\d{1}|3\\d{1}-[4-9]\\d{1}|4\\d{1}-[5-9]\\d{1}|5\\d{1}-[6-9]\\d{1}|6\\d{1}-[7-9]\\d{1}|7\\d{1}-[8-9]\\d{1}|8\\d{1}-[9-9]\\d{1})|([1-9]\\d{0})(?:0\\d{0}-\\3[1-9]\\d{0}|1\\d{0}-\\3[2-9]\\d{0}|2\\d{0}-\\3[3-9]\\d{0}|3\\d{0}-\\3[4-9]\\d{0}|4\\d{0}-\\3[5-9]\\d{0}|5\\d{0}-\\3[6-9]\\d{0}|6\\d{0}-\\3[7-9]\\d{0}|7\\d{0}-\\3[8-9]\\d{0}|8\\d{0}-\\3[9-9]\\d{0})|([1-9]\\d{2})-\\4|(?:1\\d{2}-[2-9]\\d{2}|2\\d{2}-[3-9]\\d{2}|3\\d{2}-[4-9]\\d{2}|4\\d{2}-[5-9]\\d{2}|5\\d{2}-[6-9]\\d{2}|6\\d{2}-[7-9]\\d{2}|7\\d{2}-[8-9]\\d{2}|8\\d{2}-[9-9]\\d{2})|([1-9]\\d{0})(?:0\\d{1}-\\5[1-9]\\d{1}|1\\d{1}-\\5[2-9]\\d{1}|2\\d{1}-\\5[3-9]\\d{1}|3\\d{1}-\\5[4-9]\\d{1}|4\\d{1}-\\5[5-9]\\d{1}|5\\d{1}-\\5[6-9]\\d{1}|6\\d{1}-\\5[7-9]\\d{1}|7\\d{1}-\\5[8-9]\\d{1}|8\\d{1}-\\5[9-9]\\d{1})|([1-9]\\d{1})(?:0\\d{0}-\\6[1-9]\\d{0}|1\\d{0}-\\6[2-9]\\d{0}|2\\d{0}-\\6[3-9]\\d{0}|3\\d{0}-\\6[4-9]\\d{0}|4\\d{0}-\\6[5-9]\\d{0}|5\\d{0}-\\6[6-9]\\d{0}|6\\d{0}-\\6[7-9]\\d{0}|7\\d{0}-\\6[8-9]\\d{0}|8\\d{0}-\\6[9-9]\\d{0})|([1-9]\\d{3})-\\7|(?:1\\d{3}-[2-9]\\d{3}|2\\d{3}-[3-9]\\d{3}|3\\d{3}-[4-9]\\d{3}|4\\d{3}-[5-9]\\d{3}|5\\d{3}-[6-9]\\d{3}|6\\d{3}-[7-9]\\d{3}|7\\d{3}-[8-9]\\d{3}|8\\d{3}-[9-9]\\d{3})|([1-9]\\d{0})(?:0\\d{2}-\\8[1-9]\\d{2}|1\\d{2}-\\8[2-9]\\d{2}|2\\d{2}-\\8[3-9]\\d{2}|3\\d{2}-\\8[4-9]\\d{2}|4\\d{2}-\\8[5-9]\\d{2}|5\\d{2}-\\8[6-9]\\d{2}|6\\d{2}-\\8[7-9]\\d{2}|7\\d{2}-\\8[8-9]\\d{2}|8\\d{2}-\\8[9-9]\\d{2})|([1-9]\\d{1})(?:0\\d{1}-\\9[1-9]\\d{1}|1\\d{1}-\\9[2-9]\\d{1}|2\\d{1}-\\9[3-9]\\d{1}|3\\d{1}-\\9[4-9]\\d{1}|4\\d{1}-\\9[5-9]\\d{1}|5\\d{1}-\\9[6-9]\\d{1}|6\\d{1}-\\9[7-9]\\d{1}|7\\d{1}-\\9[8-9]\\d{1}|8\\d{1}-\\9[9-9]\\d{1})|([1-9]\\d{2})(?:0\\d{0}-\\10[1-9]\\d{0}|1\\d{0}-\\10[2-9]\\d{0}|2\\d{0}-\\10[3-9]\\d{0}|3\\d{0}-\\10[4-9]\\d{0}|4\\d{0}-\\10[5-9]\\d{0}|5\\d{0}-\\10[6-9]\\d{0}|6\\d{0}-\\10[7-9]\\d{0}|7\\d{0}-\\10[8-9]\\d{0}|8\\d{0}-\\10[9-9]\\d{0})|([1-9]\\d{4})-\\11|(?:1\\d{4}-[2-9]\\d{4}|2\\d{4}-[3-9]\\d{4}|3\\d{4}-[4-9]\\d{4}|4\\d{4}-[5-9]\\d{4}|5\\d{4}-[6-9]\\d{4}|6\\d{4}-[7-9]\\d{4}|7\\d{4}-[8-9]\\d{4}|8\\d{4}-[9-9]\\d{4})|([1-9]\\d{0})(?:0\\d{3}-\\12[1-9]\\d{3}|1\\d{3}-\\12[2-9]\\d{3}|2\\d{3}-\\12[3-9]\\d{3}|3\\d{3}-\\12[4-9]\\d{3}|4\\d{3}-\\12[5-9]\\d{3}|5\\d{3}-\\12[6-9]\\d{3}|6\\d{3}-\\12[7-9]\\d{3}|7\\d{3}-\\12[8-9]\\d{3}|8\\d{3}-\\12[9-9]\\d{3})|([1-9]\\d{1})(?:0\\d{2}-\\13[1-9]\\d{2}|1\\d{2}-\\13[2-9]\\d{2}|2\\d{2}-\\13[3-9]\\d{2}|3\\d{2}-\\13[4-9]\\d{2}|4\\d{2}-\\13[5-9]\\d{2}|5\\d{2}-\\13[6-9]\\d{2}|6\\d{2}-\\13[7-9]\\d{2}|7\\d{2}-\\13[8-9]\\d{2}|8\\d{2}-\\13[9-9]\\d{2})|([1-9]\\d{2})(?:0\\d{1}-\\14[1-9]\\d{1}|1\\d{1}-\\14[2-9]\\d{1}|2\\d{1}-\\14[3-9]\\d{1}|3\\d{1}-\\14[4-9]\\d{1}|4\\d{1}-\\14[5-9]\\d{1}|5\\d{1}-\\14[6-9]\\d{1}|6\\d{1}-\\14[7-9]\\d{1}|7\\d{1}-\\14[8-9]\\d{1}|8\\d{1}-\\14[9-9]\\d{1})|([1-9]\\d{3})(?:0\\d{0}-\\15[1-9]\\d{0}|1\\d{0}-\\15[2-9]\\d{0}|2\\d{0}-\\15[3-9]\\d{0}|3\\d{0}-\\15[4-9]\\d{0}|4\\d{0}-\\15[5-9]\\d{0}|5\\d{0}-\\15[6-9]\\d{0}|6\\d{0}-\\15[7-9]\\d{0}|7\\d{0}-\\15[8-9]\\d{0}|8\\d{0}-\\15[9-9]\\d{0})|([1-9]\\d{5})-\\16|(?:1\\d{5}-[2-9]\\d{5}|2\\d{5}-[3-9]\\d{5}|3\\d{5}-[4-9]\\d{5}|4\\d{5}-[5-9]\\d{5}|5\\d{5}-[6-9]\\d{5}|6\\d{5}-[7-9]\\d{5}|7\\d{5}-[8-9]\\d{5}|8\\d{5}-[9-9]\\d{5})|([1-9]\\d{0})(?:0\\d{4}-\\17[1-9]\\d{4}|1\\d{4}-\\17[2-9]\\d{4}|2\\d{4}-\\17[3-9]\\d{4}|3\\d{4}-\\17[4-9]\\d{4}|4\\d{4}-\\17[5-9]\\d{4}|5\\d{4}-\\17[6-9]\\d{4}|6\\d{4}-\\17[7-9]\\d{4}|7\\d{4}-\\17[8-9]\\d{4}|8\\d{4}-\\17[9-9]\\d{4})|([1-9]\\d{1})(?:0\\d{3}-\\18[1-9]\\d{3}|1\\d{3}-\\18[2-9]\\d{3}|2\\d{3}-\\18[3-9]\\d{3}|3\\d{3}-\\18[4-9]\\d{3}|4\\d{3}-\\18[5-9]\\d{3}|5\\d{3}-\\18[6-9]\\d{3}|6\\d{3}-\\18[7-9]\\d{3}|7\\d{3}-\\18[8-9]\\d{3}|8\\d{3}-\\18[9-9]\\d{3})|([1-9]\\d{2})(?:0\\d{2}-\\19[1-9]\\d{2}|1\\d{2}-\\19[2-9]\\d{2}|2\\d{2}-\\19[3-9]\\d{2}|3\\d{2}-\\19[4-9]\\d{2}|4\\d{2}-\\19[5-9]\\d{2}|5\\d{2}-\\19[6-9]\\d{2}|6\\d{2}-\\19[7-9]\\d{2}|7\\d{2}-\\19[8-9]\\d{2}|8\\d{2}-\\19[9-9]\\d{2})|([1-9]\\d{3})(?:0\\d{1}-\\20[1-9]\\d{1}|1\\d{1}-\\20[2-9]\\d{1}|2\\d{1}-\\20[3-9]\\d{1}|3\\d{1}-\\20[4-9]\\d{1}|4\\d{1}-\\20[5-9]\\d{1}|5\\d{1}-\\20[6-9]\\d{1}|6\\d{1}-\\20[7-9]\\d{1}|7\\d{1}-\\20[8-9]\\d{1}|8\\d{1}-\\20[9-9]\\d{1})|([1-9]\\d{4})(?:0\\d{0}-\\21[1-9]\\d{0}|1\\d{0}-\\21[2-9]\\d{0}|2\\d{0}-\\21[3-9]\\d{0}|3\\d{0}-\\21[4-9]\\d{0}|4\\d{0}-\\21[5-9]\\d{0}|5\\d{0}-\\21[6-9]\\d{0}|6\\d{0}-\\21[7-9]\\d{0}|7\\d{0}-\\21[8-9]\\d{0}|8\\d{0}-\\21[9-9]\\d{0})|([1-9]\\d{6})-\\22|(?:1\\d{6}-[2-9]\\d{6}|2\\d{6}-[3-9]\\d{6}|3\\d{6}-[4-9]\\d{6}|4\\d{6}-[5-9]\\d{6}|5\\d{6}-[6-9]\\d{6}|6\\d{6}-[7-9]\\d{6}|7\\d{6}-[8-9]\\d{6}|8\\d{6}-[9-9]\\d{6})|([1-9]\\d{0})(?:0\\d{5}-\\23[1-9]\\d{5}|1\\d{5}-\\23[2-9]\\d{5}|2\\d{5}-\\23[3-9]\\d{5}|3\\d{5}-\\23[4-9]\\d{5}|4\\d{5}-\\23[5-9]\\d{5}|5\\d{5}-\\23[6-9]\\d{5}|6\\d{5}-\\23[7-9]\\d{5}|7\\d{5}-\\23[8-9]\\d{5}|8\\d{5}-\\23[9-9]\\d{5})|([1-9]\\d{1})(?:0\\d{4}-\\24[1-9]\\d{4}|1\\d{4}-\\24[2-9]\\d{4}|2\\d{4}-\\24[3-9]\\d{4}|3\\d{4}-\\24[4-9]\\d{4}|4\\d{4}-\\24[5-9]\\d{4}|5\\d{4}-\\24[6-9]\\d{4}|6\\d{4}-\\24[7-9]\\d{4}|7\\d{4}-\\24[8-9]\\d{4}|8\\d{4}-\\24[9-9]\\d{4})|([1-9]\\d{2})(?:0\\d{3}-\\25[1-9]\\d{3}|1\\d{3}-\\25[2-9]\\d{3}|2\\d{3}-\\25[3-9]\\d{3}|3\\d{3}-\\25[4-9]\\d{3}|4\\d{3}-\\25[5-9]\\d{3}|5\\d{3}-\\25[6-9]\\d{3}|6\\d{3}-\\25[7-9]\\d{3}|7\\d{3}-\\25[8-9]\\d{3}|8\\d{3}-\\25[9-9]\\d{3})|([1-9]\\d{3})(?:0\\d{2}-\\26[1-9]\\d{2}|1\\d{2}-\\26[2-9]\\d{2}|2\\d{2}-\\26[3-9]\\d{2}|3\\d{2}-\\26[4-9]\\d{2}|4\\d{2}-\\26[5-9]\\d{2}|5\\d{2}-\\26[6-9]\\d{2}|6\\d{2}-\\26[7-9]\\d{2}|7\\d{2}-\\26[8-9]\\d{2}|8\\d{2}-\\26[9-9]\\d{2})|([1-9]\\d{4})(?:0\\d{1}-\\27[1-9]\\d{1}|1\\d{1}-\\27[2-9]\\d{1}|2\\d{1}-\\27[3-9]\\d{1}|3\\d{1}-\\27[4-9]\\d{1}|4\\d{1}-\\27[5-9]\\d{1}|5\\d{1}-\\27[6-9]\\d{1}|6\\d{1}-\\27[7-9]\\d{1}|7\\d{1}-\\27[8-9]\\d{1}|8\\d{1}-\\27[9-9]\\d{1})|([1-9]\\d{5})(?:0\\d{0}-\\28[1-9]\\d{0}|1\\d{0}-\\28[2-9]\\d{0}|2\\d{0}-\\28[3-9]\\d{0}|3\\d{0}-\\28[4-9]\\d{0}|4\\d{0}-\\28[5-9]\\d{0}|5\\d{0}-\\28[6-9]\\d{0}|6\\d{0}-\\28[7-9]\\d{0}|7\\d{0}-\\28[8-9]\\d{0}|8\\d{0}-\\28[9-9]\\d{0})|([1-9]\\d{7})-\\29|(?:1\\d{7}-[2-9]\\d{7}|2\\d{7}-[3-9]\\d{7}|3\\d{7}-[4-9]\\d{7}|4\\d{7}-[5-9]\\d{7}|5\\d{7}-[6-9]\\d{7}|6\\d{7}-[7-9]\\d{7}|7\\d{7}-[8-9]\\d{7}|8\\d{7}-[9-9]\\d{7})|([1-9]\\d{0})(?:0\\d{6}-\\30[1-9]\\d{6}|1\\d{6}-\\30[2-9]\\d{6}|2\\d{6}-\\30[3-9]\\d{6}|3\\d{6}-\\30[4-9]\\d{6}|4\\d{6}-\\30[5-9]\\d{6}|5\\d{6}-\\30[6-9]\\d{6}|6\\d{6}-\\30[7-9]\\d{6}|7\\d{6}-\\30[8-9]\\d{6}|8\\d{6}-\\30[9-9]\\d{6})|([1-9]\\d{1})(?:0\\d{5}-\\31[1-9]\\d{5}|1\\d{5}-\\31[2-9]\\d{5}|2\\d{5}-\\31[3-9]\\d{5}|3\\d{5}-\\31[4-9]\\d{5}|4\\d{5}-\\31[5-9]\\d{5}|5\\d{5}-\\31[6-9]\\d{5}|6\\d{5}-\\31[7-9]\\d{5}|7\\d{5}-\\31[8-9]\\d{5}|8\\d{5}-\\31[9-9]\\d{5})|([1-9]\\d{2})(?:0\\d{4}-\\32[1-9]\\d{4}|1\\d{4}-\\32[2-9]\\d{4}|2\\d{4}-\\32[3-9]\\d{4}|3\\d{4}-\\32[4-9]\\d{4}|4\\d{4}-\\32[5-9]\\d{4}|5\\d{4}-\\32[6-9]\\d{4}|6\\d{4}-\\32[7-9]\\d{4}|7\\d{4}-\\32[8-9]\\d{4}|8\\d{4}-\\32[9-9]\\d{4})|([1-9]\\d{3})(?:0\\d{3}-\\33[1-9]\\d{3}|1\\d{3}-\\33[2-9]\\d{3}|2\\d{3}-\\33[3-9]\\d{3}|3\\d{3}-\\33[4-9]\\d{3}|4\\d{3}-\\33[5-9]\\d{3}|5\\d{3}-\\33[6-9]\\d{3}|6\\d{3}-\\33[7-9]\\d{3}|7\\d{3}-\\33[8-9]\\d{3}|8\\d{3}-\\33[9-9]\\d{3})|([1-9]\\d{4})(?:0\\d{2}-\\34[1-9]\\d{2}|1\\d{2}-\\34[2-9]\\d{2}|2\\d{2}-\\34[3-9]\\d{2}|3\\d{2}-\\34[4-9]\\d{2}|4\\d{2}-\\34[5-9]\\d{2}|5\\d{2}-\\34[6-9]\\d{2}|6\\d{2}-\\34[7-9]\\d{2}|7\\d{2}-\\34[8-9]\\d{2}|8\\d{2}-\\34[9-9]\\d{2})|([1-9]\\d{5})(?:0\\d{1}-\\35[1-9]\\d{1}|1\\d{1}-\\35[2-9]\\d{1}|2\\d{1}-\\35[3-9]\\d{1}|3\\d{1}-\\35[4-9]\\d{1}|4\\d{1}-\\35[5-9]\\d{1}|5\\d{1}-\\35[6-9]\\d{1}|6\\d{1}-\\35[7-9]\\d{1}|7\\d{1}-\\35[8-9]\\d{1}|8\\d{1}-\\35[9-9]\\d{1})|([1-9]\\d{6})(?:0\\d{0}-\\36[1-9]\\d{0}|1\\d{0}-\\36[2-9]\\d{0}|2\\d{0}-\\36[3-9]\\d{0}|3\\d{0}-\\36[4-9]\\d{0}|4\\d{0}-\\36[5-9]\\d{0}|5\\d{0}-\\36[6-9]\\d{0}|6\\d{0}-\\36[7-9]\\d{0}|7\\d{0}-\\36[8-9]\\d{0}|8\\d{0}-\\36[9-9]\\d{0})|([1-9]\\d{8})-\\37|(?:1\\d{8}-[2-9]\\d{8}|2\\d{8}-[3-9]\\d{8}|3\\d{8}-[4-9]\\d{8}|4\\d{8}-[5-9]\\d{8}|5\\d{8}-[6-9]\\d{8}|6\\d{8}-[7-9]\\d{8}|7\\d{8}-[8-9]\\d{8}|8\\d{8}-[9-9]\\d{8})|([1-9]\\d{0})(?:0\\d{7}-\\38[1-9]\\d{7}|1\\d{7}-\\38[2-9]\\d{7}|2\\d{7}-\\38[3-9]\\d{7}|3\\d{7}-\\38[4-9]\\d{7}|4\\d{7}-\\38[5-9]\\d{7}|5\\d{7}-\\38[6-9]\\d{7}|6\\d{7}-\\38[7-9]\\d{7}|7\\d{7}-\\38[8-9]\\d{7}|8\\d{7}-\\38[9-9]\\d{7})|([1-9]\\d{1})(?:0\\d{6}-\\39[1-9]\\d{6}|1\\d{6}-\\39[2-9]\\d{6}|2\\d{6}-\\39[3-9]\\d{6}|3\\d{6}-\\39[4-9]\\d{6}|4\\d{6}-\\39[5-9]\\d{6}|5\\d{6}-\\39[6-9]\\d{6}|6\\d{6}-\\39[7-9]\\d{6}|7\\d{6}-\\39[8-9]\\d{6}|8\\d{6}-\\39[9-9]\\d{6})|([1-9]\\d{2})(?:0\\d{5}-\\40[1-9]\\d{5}|1\\d{5}-\\40[2-9]\\d{5}|2\\d{5}-\\40[3-9]\\d{5}|3\\d{5}-\\40[4-9]\\d{5}|4\\d{5}-\\40[5-9]\\d{5}|5\\d{5}-\\40[6-9]\\d{5}|6\\d{5}-\\40[7-9]\\d{5}|7\\d{5}-\\40[8-9]\\d{5}|8\\d{5}-\\40[9-9]\\d{5})|([1-9]\\d{3})(?:0\\d{4}-\\41[1-9]\\d{4}|1\\d{4}-\\41[2-9]\\d{4}|2\\d{4}-\\41[3-9]\\d{4}|3\\d{4}-\\41[4-9]\\d{4}|4\\d{4}-\\41[5-9]\\d{4}|5\\d{4}-\\41[6-9]\\d{4}|6\\d{4}-\\41[7-9]\\d{4}|7\\d{4}-\\41[8-9]\\d{4}|8\\d{4}-\\41[9-9]\\d{4})|([1-9]\\d{4})(?:0\\d{3}-\\42[1-9]\\d{3}|1\\d{3}-\\42[2-9]\\d{3}|2\\d{3}-\\42[3-9]\\d{3}|3\\d{3}-\\42[4-9]\\d{3}|4\\d{3}-\\42[5-9]\\d{3}|5\\d{3}-\\42[6-9]\\d{3}|6\\d{3}-\\42[7-9]\\d{3}|7\\d{3}-\\42[8-9]\\d{3}|8\\d{3}-\\42[9-9]\\d{3})|([1-9]\\d{5})(?:0\\d{2}-\\43[1-9]\\d{2}|1\\d{2}-\\43[2-9]\\d{2}|2\\d{2}-\\43[3-9]\\d{2}|3\\d{2}-\\43[4-9]\\d{2}|4\\d{2}-\\43[5-9]\\d{2}|5\\d{2}-\\43[6-9]\\d{2}|6\\d{2}-\\43[7-9]\\d{2}|7\\d{2}-\\43[8-9]\\d{2}|8\\d{2}-\\43[9-9]\\d{2})|([1-9]\\d{6})(?:0\\d{1}-\\44[1-9]\\d{1}|1\\d{1}-\\44[2-9]\\d{1}|2\\d{1}-\\44[3-9]\\d{1}|3\\d{1}-\\44[4-9]\\d{1}|4\\d{1}-\\44[5-9]\\d{1}|5\\d{1}-\\44[6-9]\\d{1}|6\\d{1}-\\44[7-9]\\d{1}|7\\d{1}-\\44[8-9]\\d{1}|8\\d{1}-\\44[9-9]\\d{1})|([1-9]\\d{7})(?:0\\d{0}-\\45[1-9]\\d{0}|1\\d{0}-\\45[2-9]\\d{0}|2\\d{0}-\\45[3-9]\\d{0}|3\\d{0}-\\45[4-9]\\d{0}|4\\d{0}-\\45[5-9]\\d{0}|5\\d{0}-\\45[6-9]\\d{0}|6\\d{0}-\\45[7-9]\\d{0}|7\\d{0}-\\45[8-9]\\d{0}|8\\d{0}-\\45[9-9]\\d{0}))$"
            }
          },
          "required": ["ref"]
        }
      ]
    }
  ]
}
