{
  "schema_version": 1,
  "ref": "context/wiki/architecture.md#section=execution-boundary",
  "digest": "sha256:1111111111111111111111111111111111111111111111111111111111111111",
  "kind": "wiki",
  "reason": "The executor needs the canonical execution-boundary decision.",
  "retrieval": "exact",
  "required": true,
  "score": 1
}
